id,caption
38,"The image shows a skin condition characterized by areas of purplish discoloration and black eschar-like necrotic lesions. This appearance is suggestive of calciphylaxis, a condition often seen in patients with chronic kidney disease (CKD).

Medications that can cause or exacerbate calciphylaxis in CKD patients include:

1. **Warfarin**: This anticoagulant is known to be associated with an increased risk of calciphylaxis.
2. **Calcium-based phosphate binders**: These can contribute to calcium overload.
3. **Vitamin D supplements**: Excessive use can lead to hypercalcemia.
4. **Systemic corticosteroids**: Though less commonly, they may play a role.

Warfarin is especially notable among these medications for its association with this condition in CKD patients."
39,"The image shows an acid-fast bacilli (AFB) smear, which is used to detect Mycobacterium tuberculosis, the bacteria causing tuberculosis (TB). The presence of these bacilli suggests a TB infection.

The most common side effect of treating tuberculosis with first-line anti-tuberculosis drugs, such as isoniazid, rifampicin, ethambutol, and pyrazinamide, is hepatotoxicity, which can lead to liver damage. Patients undergoing treatment may experience symptoms like nausea, vomiting, and jaundice, indicating liver issues. Regular monitoring of liver function is essential during treatment."
40,"The image shows a forearm with a diffuse rash characterized by multiple red spots or lesions, consistent with a petechial or purpuric rash. The clinical presentation and laboratory findings (fever, rash on hands and feet, elevated bands, thrombocytopenia, and renal impairment) suggest a diagnosis of Rocky Mountain Spotted Fever (RMSF).

Treatment for RMSF should be initiated promptly to avoid severe complications and typically involves:

- **Doxycycline**, which is the drug of choice for RMSF in adults and children of all ages. It is critical to start this treatment as soon as RMSF is suspected, even before confirmatory lab results are available."
41,"The biomedical image depicts the left hand of a 61-year-old patient with type 2 diabetes, showing significant edema and redness. There are large, tense blisters present on the hand, indicating inflammation and possible infection, consistent with the described symptoms of severe pain and redness.

In this clinical context, the presence of tense bullae (blisters) is a poor prognostic sign, as it suggests necrotizing fasciitis, a rapidly progressing soft tissue infection. Immediate medical intervention is crucial."
42,"The chest X-ray shows a large area of increased radiolucency on the left side, indicating the presence of a pneumothorax. The left lung is collapsed, and there's a leftward shift of the mediastinum, suggesting tension pneumothorax.

Given the patient's clinical status of obtundation, hypotension, tachycardia, and hypoxemia, immediate action is required:

**Immediate Needle Decompression:**
- Perform needle decompression in the 2nd intercostal space at the midclavicular line on the affected side (left).
- Follow this with the placement of a chest tube for definitive treatment and ongoing management of the pneumothorax."
43,"The ECG in the image shows significant abnormalities likely related to severe hypokalemia (potassium level of 2.2 mEq/L). Common ECG findings in hypokalemia include prominent U waves, ST segment depression, and flattened T waves. In the context of hypokalemia and bradycardia, this pattern may be complicating the patient’s existing heart failure and atrial fibrillation.

For the hypokalemia treatment:

- **Administration Method**: Potassium chloride (KCl) should be administered intravenously for rapid correction. Given the severe hypokalemia and associated symptoms, IV administration is preferred to oral.

- **Rate of Administration**: Care should be taken to administer slowly to prevent complications such as phlebitis or cardiac arrhythmias. A common approach is to infuse 10 mEq/hour, and monitoring should be continuous or frequent.

- **Monitoring**: Continuous ECG monitoring is recommended during administration due to the risk of arrhythmias.

This approach aims to rapidly correct the potassium deficit while ensuring patient safety."
44,"The biomedical image shows a cluster of vesicular lesions on the skin, likely indicative of a rash consistent with shingles (herpes zoster). This is common in immunocompromised individuals, such as those on immunosuppressive therapy post-transplant.

Given the patient's condition and the appearance of a vesicular rash consistent with herpes zoster, the correct treatment would be antiviral therapy such as **Acyclovir, Valacyclovir,** or **Famciclovir.** Prompt treatment is essential to prevent complications, such as postherpetic neuralgia, especially in an immunocompromised individual."
45,"The peripheral blood smear in the image shows numerous large cells with prominent granules and bilobed nucleus, which are characteristic of promyelocytes. This appearance is suggestive of acute promyelocytic leukemia (APL). The laboratory findings, such as low hemoglobin, leukopenia, thrombocytopenia, prolonged PTT, and low fibrinogen, support the diagnosis by indicating a coagulopathy often associated with APL."
46,"The chest X-ray image shows hyperinflated lungs, which is indicative of air trapping, commonly seen in obstructive pulmonary diseases such as asthma or chronic obstructive pulmonary disease (COPD). This is supported by the clinical findings of prolonged expiration and wheezing. The presence of fine inspiratory crackles may suggest some level of airway inflammation or parenchymal involvement. Given the patient's symptoms of chronic cough and the radiographic findings, the condition could be consistent with asthma or early COPD. Further evaluation with pulmonary function tests would be useful for diagnosis."
47,"The ECG shows a regular, wide-complex tachycardia with a rapid heart rate, suggesting ventricular tachycardia. Indicators of a ventricular origin include:

1. Wide QRS complexes: The QRS duration appears prolonged.
2. Absence of P waves or AV dissociation: Suggesting the atria are not coordinating with the ventricles.
3. Extreme axis deviation or bizarre morphology, often seen in ventricular rhythms.

These features support the diagnosis of a ventricular arrhythmia, such as ventricular tachycardia."
48,"The echocardiography image shows a narrowed left ventricular outflow tract and possibly leaflet thickening, suggesting aortic stenosis. Given the patient's symptoms—shortness of breath on exertion—and medical history, the most likely finding on physical examination would be a systolic ejection murmur best heard at the right second intercostal space, which often radiates to the carotids. This murmur is characteristic of aortic stenosis."
49,"The ECG chart shows an irregularly irregular rhythm with absent P waves, which is indicative of atrial fibrillation. This patient likely has atrial fibrillation with rapid ventricular response. Given the atrial fibrillation and symptoms of vertigo and diarrhea, it is possible that the patient is experiencing digitalis toxicity, especially if he is on digoxin for atrial fibrillation rate control. Signs of digitalis toxicity on ECG can include irregular rhythms, ventricular ectopy, and various degrees of heart block.

"
50,"The echocardiogram shows dilated right heart chambers (right atrium and right ventricle) and a relatively compressed left ventricle. This suggests the presence of right ventricular strain, which is consistent with massive pulmonary embolism.

Given the clinical scenario of a 60-year-old heavy smoker with acute shortness of breath, low blood pressure, and the echocardiographic findings, the most likely physical examination finding is distended neck veins, due to elevated central venous pressure from the pulmonary embolism."
51,"The ECG image displays low voltage QRS complexes, which, combined with the clinical presentation of worsening shortness of breath and leg edema along with echocardiography findings of thickened ventricles and enlarged atria, suggests the possibility of cardiac amyloidosis or another infiltrative cardiomyopathy.

For further imaging to evaluate this suspicion, a cardiac MRI would be the next step. Cardiac MRI can provide detailed information on myocardial tissue characterization and detect infiltration patterns typical of conditions like cardiac amyloidosis."
52,"The chest X-ray shows bilateral opacities, potentially indicative of pneumonia or another pulmonary condition, given the patient's productive cough and history of asthma. 

For an ICU-admitted patient with community-acquired pneumonia (CAP) and no recent antibiotic use, typically a beta-lactam (like ceftriaxone or ampicillin-sulbactam) plus a macrolide (such as azithromycin) is recommended. Alternatively, a respiratory fluoroquinolone (like levofloxacin) may be used. Always consider local guidelines and the patient's specific medical history."
53,"The image shows the legs of a person with a noticeable mottled, lace-like purplish rash, commonly referred to as livedo reticularis. This finding, combined with the patient's symptoms of right-sided paralysis, high blood pressure, and the presence of a systolic murmur, suggests a possible diagnosis of an embolic event, likely due to a condition such as antiphospholipid syndrome. The rash and clinical presentation align with this diagnosis."
54,"The ECG segment displays a regular rhythm with a narrow QRS complex, characteristic of a normal sinus rhythm. The heart rate appears to be within normal limits, and no obvious abnormalities, such as arrhythmias or ischemic changes, are visible. Given that the patient is asymptomatic, it would be reasonable to continue routine monitoring and follow-up with a healthcare provider as needed. However, clinical correlation and further medical evaluation are essential for a comprehensive assessment."
55,"Based on the clinical scenario and CT scan findings, the image shows characteristics consistent with Idiopathic Pulmonary Fibrosis (IPF), such as reticular patterns and honeycombing at the lung bases, indicating fibrosis.

The next step in managing the patient with IPF would involve:

1. **Initiation of Antifibrotic Therapy:** Consider starting medications such as nintedanib or pirfenidone to slow disease progression.
   
2. **Supportive Care:** Including supplemental oxygen if needed, pulmonary rehabilitation, and vaccination against influenza and pneumococcal infections.
   
3. **Referral to a Specialist Center for Advanced Care:** Evaluate for possible lung transplantation if the patient is a candidate.

4. **Smoking Cessation Support:** Given the patient’s history of smoking, it is crucial to provide support for quitting smoking."
56,"The image shows a hand with multiple small, dark red spots distributed across the palm, which suggests the presence of Janeway lesions. These are typically associated with infectious endocarditis.

In the context of the provided clinical details, definite endocarditis can be defined using the Duke Criteria, which include:

1. **Major Criteria:**
   - Positive blood cultures for organisms consistent with infective endocarditis, such as Aggregatibacter, found in two separate cultures.
   - Evidence of endocardial involvement seen through echocardiography or presence of a new murmur.

2. **Minor Criteria:**
   - Predisposing heart condition or intravenous drug use.
   - Fever.
   - Vascular phenomena like Janeway lesions.
   - Immunological phenomena (e.g., glomerulonephritis).
   - Positive blood culture not meeting major criteria.

In this patient, definite endocarditis is supported by the presence of a positive blood culture for Aggregatibacter and the vascular phenomenon indicated by the hand rash, alongside recent dental treatment which can be a predisposing factor."
57,"The microscopic view of the urine sediment shows numerous red blood cells. This finding, along with the clinical presentation of hematuria and proteinuria, is suggestive of glomerulonephritis as the most likely cause of the patient's acute renal failure."
58,"The image shows the hands of a 50-year-old male with noticeable changes in the distal interphalangeal (DIP) joints of the fingers. There appears to be swelling, which is consistent with changes seen in finger clubbing. 

The most common cause of finger clubbing is often related to pulmonary diseases, such as lung cancer, but also chronic conditions like interstitial lung disease or cystic fibrosis. However, given the age and symptoms, it might also be associated with osteoarthritis if there is pain in the DIP joints, typically presenting as Heberden's nodes."
59,"The biomedical image is an electrocardiogram (ECG) showing atrial fibrillation, characterized by an irregularly irregular rhythm with no distinct P waves and variable R-R intervals. The ventricles are being driven at a rapid rate (150 bpm), contributing to the patient's hemodynamic instability, evidenced by low blood pressure (80/40 mmHg), inadequate oxygen saturation (85%), and clinical signs of pulmonary edema.

For a hemodynamically unstable patient with atrial fibrillation and signs of pulmonary edema, the next step is urgent electrical cardioversion to restore sinus rhythm. This intervention can help stabilize blood pressure and improve oxygenation by restoring effective cardiac output."
60,"The image is a nomogram used to assess the risk of hepatotoxicity in cases of acetaminophen overdose. 

- The x-axis represents hours after acetaminophen ingestion, ranging from 4 to 28 hours.
- The y-axis shows the plasma acetaminophen concentration in both µmol/L and µg/mL.
- There are three lines depicted: a red line indicating the lower limit for the high-risk group, a green dashed line for the probable-risk group, and a brown study nomogram line.

In the scenario described, the patient's blood level of acetaminophen is 250 mg/mL four hours post-ingestion. This level is significantly above the high-risk line on the nomogram.

**Next Step:**
The next step is to administer N-acetylcysteine (NAC) as an antidote to prevent liver damage."
61,"The image shows a large ulcerative lesion on the shin with an inflamed and erythematous border. The lesion appears necrotic and may present with purulent or crusted areas.

### Diagnostic Direction:
Given the symptoms of extreme weakness, peripheral arthritis, and anemia (hemoglobin 10 g/dL), along with an elevated C-reactive protein (CRP) indicating inflammation, and the presence of the ulcerative skin lesion, the anamnesis should be expanded in the direction of:

1. **Autoimmune Disorders**: Considering conditions like vasculitis, particularly Behçet's disease or systemic lupus erythematosus, which can present with skin lesions, arthritis, and systemic symptoms.

2. **Infectious Causes**: Assess for infections that can cause similar lesions, such as bacterial skin infections (e.g., cellulitis) or fungal infections, especially in immunocompromised individuals.

3. **Inflammatory Bowel Disease**: Investigate for signs and symptoms of IBD, such as Crohn’s disease, which can be associated with pyoderma gangrenosum, a condition that presents as painful skin ulcers.

4. **Vascular Issues**: Consider peripheral vascular disease or venous insufficiency, which could contribute to the development of such lesions.

5. **Dermatological Conditions**: Such as pyoderma gangrenosum, which is known to present with similar painful ulcers on the lower extremities and is often associated with systemic conditions like arthritis."
62,"The biomedical image shows purpuric rash on a patient's arms and legs. This rash, alongside symptoms such as fever, severe headache, vomiting, confusion, and the results from the lumbar puncture (80 cells, mostly mononuclear, elevated protein, and normal glucose), is indicative of viral meningitis. The purpuric rash and clinical presentation suggest a condition like meningococcal infection."
63,"The image shows a rash characterized by multiple red lesions on the palms, which is suggestive of a secondary syphilis rash. In a patient with HIV presenting with fever, headache, and widespread rash, the appropriate treatment for secondary syphilis is penicillin, specifically benzathine penicillin G."
64,"The image is a chest X-ray showing the lung fields and mediastinum. The question seems to refer to pneumothorax, a condition where air enters the pleural space causing lung collapse. In the X-ray:

- There might be a visible pleural line indicating separation from the chest wall.
- The affected area could appear more radiolucent (darker) due to the presence of air.
- Absence of vascular markings beyond the pleural line is typical.

The X-ray might also show the placement of a chest tube indicating management of the condition."
65,"The ECG in the image shows regular sinus rhythm with wide QRS complexes, which is indicative of left bundle branch block (LBBB). This is consistent with the patient's known diagnosis of heart failure with reduced ejection fraction (HFrEF). The patient feels well, suggesting that this ECG pattern might be a chronic finding rather than indicative of acute cardiac decompensation."
66,"The chest X-ray shows features commonly associated with tuberculosis (TB), especially considering the patient’s background (born in the former USSR where TB prevalence might be higher). 

Key findings include:

- A cavitary lesion in the right upper lobe (indicated by the red arrow), which is suggestive of pulmonary TB.
- Consolidation in the left lower lung field (indicated by the yellow arrow), which could indicate pneumonia or another infection.

Treatment considerations would involve:

1. **Initiating TB treatment:** Anti-tuberculous therapy, generally consisting of a multi-drug regimen (e.g., isoniazid, rifampicin, ethambutol, and pyrazinamide) pending further confirmation via sputum culture or other testing.
2. **Assessing antibiotic therapy:** For any concurrent infections suggested by the X-ray findings, such as pneumonia.
3. **Monitor for complications:** Due to her advanced age and possible co-morbidities.

Early consultation with a pulmonologist or an infectious disease specialist would also be prudent."
67,"The image displays laboratory test results for a patient as follows:

- pH: 7.48 (alkalosis)
- pCO₂: 67 mmHg (elevated, indicating respiratory acidosis)
- HCO₃: 46 mEq/L (elevated, compensating for respiratory acidosis)
- Lactate: Not specified
- Glucose: 120 mg/dL
- Na (Sodium): 141 mEq/L (normal)
- K (Potassium): 5.3 mEq/L (slightly elevated)
- Cl (Chloride): 89 mEq/L (low)
- Albumin: 3.8 gr/dL (normal)

The patient is an 82-year-old woman with heart failure with reduced ejection fraction (HFrEF), suffering from anasarca resistant to high doses of Furosemide, with normal kidney function.

Given the compensated respiratory acidosis and persistent volume overload, it would be appropriate to add a thiazide diuretic like Metolazone to the regimen. This can enhance diuresis in combination with loop diuretics (Furosemide)."
68,"The chest X-ray reveals a cavitary lesion in the right lung, which is suggestive of a lung abscess, given the patient's symptoms of fever, productive cough with foul-smelling sputum, and chest pressure. The next step in management typically involves starting empirical antibiotic therapy targeting anaerobic and aerobic organisms. Additionally, further diagnostic imaging, such as a CT scan of the chest, may be needed for better characterization of the lesion and to rule out any other possible causes."
69,"The image shows an ECG (electrocardiogram) with patterns that may indicate potential heart conduction issues. The diagram shows multiple leads (I, II, III, aVR, aVL, aVF, V1-V6) tracking the electrical activity of the heart. 

In this image, there might be evidence of a heart block, such as third-degree (complete) heart block, where there is complete dissociation between the atrial and ventricular rhythms. This condition often results in severely bradycardic rates and irregular R-R intervals. Such a patient will most likely need a permanent pacemaker due to the inadequate conduction system as reflected by the ECG.

If the ECG does depict such patterns, patient 20 may be a candidate for a pacemaker to ensure regular heart rhythm and adequate cardiac output."
70,"The lab results indicate the following:

- Serum osmolality: 265 mOsm/KgH
- Serum sodium (Na): 115 mEq/L
- Urine osmolality: 80 mOsm/KgH
- Urine sodium (Na): 15 mEq/L

These findings suggest a case of hyponatremia with low serum osmolality and low urine osmolality and sodium. This is consistent with a diagnosis of primary polydipsia (also known as psychogenic polydipsia), where excessive fluid intake leads to dilutional hyponatremia. Other potential causes such as syndrome of inappropriate antidiuretic hormone secretion (SIADH) or adrenal insufficiency typically show higher urine osmolality."
71,"The X-ray image of the wrist and hand shows joint spaces and bones, which are typically assessed for signs of inflammation, erosion, or other abnormalities associated with conditions like gout or pseudogout. The clinical presentation of recurrent wrist pain, swelling, and high leukocyte count in the joint aspiration suggests an inflammatory arthritis, possibly due to crystal deposition disease.

To prevent recurrent attacks of conditions such as gout, long-term management often includes medications like allopurinol or febuxostat to lower uric acid levels. If this is pseudogout, management may focus more on managing acute attacks and underlying calcium metabolism. It's important for the patient to discuss treatment options with their healthcare provider based on the specific diagnosis."
72,"The image shows a blood smear with red blood cells, some of which appear fragmented, known as schistocytes. This finding is consistent with microangiopathic hemolytic anemia, which can occur in hypertensive emergencies such as scleroderma renal crisis.

Given the patient’s presentation with severe hypertension, renal failure, and the presence of schistocytes, this likely represents a scleroderma renal crisis. The first line of treatment for this condition is an ACE inhibitor, such as captopril, to control blood pressure and renal damage."
73,"The image shows a hand with the fourth and fifth fingers bent towards the palm, which suggests a condition known as Dupuytren's contracture. This condition is characterized by a thickening of the fibrous tissue layer underneath the skin of the palm and fingers, leading to finger flexion contractures that are most commonly seen in the ring and little fingers."
74,"The image shows hands with visible deformities and swelling, common in conditions such as rheumatoid arthritis. This disease often leads to joint damage and characteristic changes in hand appearance, such as ulnar deviation and nodules."
75,"The image shows numerous dark red to purple papules on the skin, suggestive of angiokeratomas. These are consistent with the findings of a patient with Fabry disease, which is characterized by chronic kidney failure, episodes of neuropathic pain (burning sensation in hands and feet), proteinuria, and skin lesions.

In Fabry disease, the deficiency of the enzyme alpha-galactosidase A leads to the accumulation of globotriaosylceramide, causing the symptoms described.

**Recommended Treatment:** The primary treatment for Fabry disease is enzyme replacement therapy (ERT) with alpha-galactosidase A."
76,"The ECG tracing shows characteristics consistent with hypertrophic cardiomyopathy. Common findings in such cases may include left ventricular hypertrophy with associated signs like deep S waves in V1-V3 and tall R waves in V4-V6, along with possible inverted T waves in the anterolateral leads. 

For a patient with hypertrophic cardiomyopathy and atypical chest pain:

1. **Beta-blockers**: These are often the first line of treatment to reduce heart rate and myocardial oxygen consumption.
2. **Calcium channel blockers**: Such as verapamil or diltiazem, used if beta-blockers are not tolerated.
3. **Avoidance of dehydration and extreme exertion**: These can exacerbate symptoms.
4. **Implantable cardioverter-defibrillator (ICD)**: Considered if there's a high risk of sudden cardiac death.
5. **Lifestyle changes**: May include avoiding competitive sports and heavy physical activity.

Elective procedures or medications would be considered based on the severity of symptoms and risk assessment."
77,"The CT scan image depicts a cross-sectional view of the abdomen. The anatomy includes the liver, spleen, kidneys, and segments of the gastrointestinal tract. The image may show some physiological or pathological changes, although specifics are not discernible here.

In the context of the patient, who has positive antibodies suggestive of both lupus and antiphospholipid antibody syndrome (APLA), additional features supporting a lupus diagnosis over just APLA may include:

1. Clinical signs like a butterfly rash, photosensitivity, or oral ulcers.
2. Hematological abnormalities such as leukopenia, lymphopenia, anemia, or thrombocytopenia.
3. Renal involvement evidenced by proteinuria or hematuria.
4. Neurological symptoms such as seizures or psychosis.
5. Positive anti-double-stranded DNA (anti-dsDNA) or anti-Smith antibodies.

These additional signs and laboratory findings would help differentiate lupus from isolated APLA syndrome."
