id,caption
71,"The image appears to be an X-ray of a wrist joint, showing the carpal bones, radius, and ulna. The bones are displayed in a grayscale format characteristic of X-ray imaging. Key features include:

- Clear visualization of the bony structures of the wrist.
- Distinct outlines of the carpal bones, which are arranged in two rows.
- The radius and ulna are visible, with the radial side appearing more pronounced.
- Any abnormalities, fractures, or variations in bone density are not specified, so further clinical context would be needed for diagnosis.

Overall, it provides a detailed look at the skeletal anatomy of the wrist area."
72,"The biomedical image depicts a microscopic view of red blood cells (erythrocytes) in a fluid medium. The cells appear as circular, often biconcave discs, exhibiting a pink or reddish hue against a lighter background. This type of image is commonly used in hematology to assess the morphology of blood cells, which can provide important diagnostic information about various health conditions."
73,"The image displays an open human hand exhibiting a gesture where the fingers are partially spread apart. The palm is oriented outward, and the background appears to be a solid color, likely blue. This position of the hand may be used for various purposes, including demonstrations, anatomical studies, or sign language."
74,"The image displays two human hands placed side by side, with fingers extended and palms facing downward. The hands appear aged, with visible wrinkles, protruding veins, and prominent joint structures, indicating signs of wear or potential medical conditions, such as arthritis. The background is a plain, dark surface, which provides contrast to the skin tones and textures of the hands."
75,"The image depicts a close-up view of skin with multiple dark lesions, which may appear as raised or flat spots. These lesions are surrounded by areas of normal skin and hair follicles are visible in the surrounding region. The overall appearance suggests potential dermatological issues, possibly indicating conditions such as petechiae, purpura, or other skin disorders. For accurate diagnosis and further information, a medical professional should evaluate the skin condition."
76,"The image displays an electrocardiogram (ECG) with multiple leads. The leads shown include limb leads (I, II, III, aVR, aVL, aVF) and precordial leads (V1 to V6). The ECG traces illustrate the electrical activity of the heart over time, represented by waves and intervals. Key components observed include:

- P waves: Indicate atrial depolarization.
- QRS complexes: Represent ventricular depolarization.
- T waves: Reflect ventricular repolarization.

The overall shape and configuration of these waves can help in diagnosing various cardiac conditions. The paper grid provides a reference for measuring the intervals and segments."
77,"The image is a cross-sectional view from a CT scan of the abdomen, specifically focusing on the liver area. In the scan, the following features are notable:

1. **Liver Anatomy**: The liver is partially visible, with sections displaying normal hepatic tissue structure.

2. **Fluid or Lesion Presence**: There is a prominent area at the top left, which appears darker, suggesting the presence of fluid, a cyst, or a lesion. The characteristics of this area would require further assessment to determine its nature.

3. **Vascular Structures**: Visible vascular structures have a clearer definition due to the contrast material used, outlining blood vessels in the hepatic and surrounding areas.

4. **Surrounding Structures**: Other abdominal organs and structures are present, potentially including parts of the gastrointestinal tract and adjacent anatomical landmarks.

Overall, the image provides essential information for evaluating liver health and diagnosing potential conditions related to fluid accumulation or lesions."
78,"The image displays a continuous graph consisting of three distinct waveforms, typically indicative of electroencephalography (EEG) readings. The x-axis likely represents time, while the y-axis corresponds to voltage or electrical activity. The presence of rapid oscillations and varying amplitude suggests different states of brain activity, potentially reflecting sleep stages, seizures, or other neurological conditions. The grid overlay aids in quantifying the measurements for analysis."
79,"The image appears to be a cross-sectional view from a chest CT (computed tomography) scan. It shows the thoracic cavity, including the lungs and mediastinum. Key features include:

- **Lungs**: The lung fields contain a network of blood vessels and bronchi, highlighted by the presence of vascular markings and possible air spaces.
- **Mediastinum**: The central part of the image features the heart and major blood vessels, which may be slightly enlarged or shifted depending on specific clinical conditions.
- **Surrounding structures**: Other structures such as the diaphragm and bone contours may also be visible at the periphery.

This type of imaging is typically used to assess conditions affecting the lungs, heart, and other thoracic structures. Further details or interpretations would depend on specific clinical indications or findings."
80,"The image presents an electrocardiogram (ECG) displaying several leads. Specifically, it shows:

- **Leads I, II, and III** in the first three rows, which represent the standard limb leads.
- **Leads aVR, aVL, and aVF** also shown in the first three rows, indicating augmented leads from the limbs.
- **Precordial leads V1 to V6** detailed in subsequent rows, which assess the heart's electrical activity from specific thoracic positions.

The grid background aids in measuring the amplitude and interval of the waves, allowing for the observation of various electrical activities of the heart, including the P wave, QRS complex, and T wave, which are crucial for diagnosing cardiac health. The variations in the waveforms can indicate arrhythmias, myocardial ischemia, or other cardiac conditions."
81,"The image shows an electrocardiogram (ECG) tracing with data arranged in multiple leads. It includes the following leads:

- **Lead I**
- **Lead II**
- **Lead III**
- **aVR**
- **aVL**
- **aVF**
- **V1**
- **V2**
- **V3**
- **V4**
- **V5**
- **V6**

The traces display various oscillations and patterns characteristic of electrical heart activity, allowing for the assessment of heart rhythm and electrical conduction. The grid background helps in measuring the amplitude and timing of the electrical signals. This ECG could be used for diagnostic purposes, such as identifying arrhythmias, myocardial infarction, or other cardiac conditions."
82,"The image is a chest X-ray, which displays the thoracic cavity. Key features visible in the image include:

- **Lungs**: The lungs appear on either side of the mediastinum, with distinct lung markings visible.
- **Heart**: The heart is located in the central area, showing its size and shape against the surrounding structures.
- **Ribs**: The rib cage is outlined, providing a structural view of the thoracic skeleton.
- **Mediastinum**: The central area between the lungs contains the heart, major blood vessels, trachea, and esophagus. 

Overall, the X-ray provides a view of pulmonary and cardiac structures for diagnostic evaluation."
83,"The image shows a histological section of a tissue sample, likely from a biomedical context. The tissue appears to be stained with hematoxylin and eosin (H&E), which is common for visualizing cellular structures under a microscope. 

Key features include:

- Numerous cell nuclei visible in a purple hue, indicating areas of active cellular organization and possibly highlighting lymphoid or glandular tissue.
- Larger, rounded structures that likely represent glandular components or follicles, surrounded by densely packed cells.
- A background of purple-staining cells suggests the presence of a supportive stroma or potentially inflammatory cells.

Overall, the image suggests a detailed view of cellular architecture typical in tissues involved in immune response or endocrine functions. Further context regarding the sample type would provide more specific insights."
84,"The biomedical image depicts a close-up view of a human forearm exhibiting multiple raised, reddish lesions. These lesions appear to be circular with an inflamed border and are dispersed unevenly across the skin. The background features a blue surface, likely a clinical or examination setting. The appearance of the lesions may suggest a dermatological condition, and further clinical evaluation would be necessary to determine the exact nature of the skin changes."
85,"The image shows a microscopic view of blood cells stained to highlight different cell types. The predominant features include:

- Several large cells with a distinct purple hue, likely representing leukocytes (white blood cells), indicating they have a prominent nucleus.
- Numerous smaller, round cells surrounding the leukocytes, which appear light in color and are likely erythrocytes (red blood cells), providing a contrast to the purple-stained leukocytes.

This image might be used for analyzing blood cell morphology or diagnosing hematological conditions."
86,"The biomedical image consists of three panels:

**Panel A**: A cross-sectional computed tomography (CT) scan of the chest, highlighting structures in the pulmonary region. Yellow arrows indicate specific areas of interest, likely related to the airways or blood vessels.

**Panel B**: An angiographic image displaying the vascular system in the chest. This could indicate blood flow or abnormalities, revealed through contrast imaging used for diagnosing conditions related to the heart or lungs.

**Panel C**: A microscopic image showing cells under magnification. The image highlights two distinct cellular formations, possibly representing cultured cells or a pathological specimen, with a scale bar indicating a size reference of 1 cm.

Overall, the panels likely illustrate different aspects of pulmonary health or disease, encompassing imaging techniques and cellular characteristics."
87,"The image displays a human hand, specifically the palm side. There are numerous reddish spots visible on the skin, indicating some form of skin condition or vascular change. The skin appears wrinkled and shows noticeable lines and creases, typical of aged skin. The background includes a soft towel, suggesting that the hand is being assessed in a clinical or caregiving context. The overall appearance could indicate a condition that may warrant further medical evaluation."
88,"The image appears to be a cross-sectional view from a chest CT scan. It shows the lungs and surrounding structures. The lungs display areas of attenuation, which may indicate abnormal findings such as potential lung disease, infection, or inflammation. The detail in the lung parenchyma, including any patterns of opacities or nodules, suggests a need for further evaluation by a medical professional to determine a specific diagnosis. The central area shows the mediastinum, including the heart and vascular structures."
89,"The image displays a series of electrocardiogram (ECG or EKG) readings. The ECG is a graphical representation of the electrical activity of the heart over time. 

Key features include:

- Multiple leads (I, II, III, and precordial leads V1-V6) are presented.
- Each trace represents the heart's electrical impulses, showing the P waves, QRS complexes, and T waves.
- The horizontal lines indicate intervals measured in milliseconds, suggesting the time scale of the heart's electrical cycle.
- Overall, the readouts can provide important insights into heart rhythm, potential arrhythmias, and other cardiac conditions.

These details are essential for healthcare professionals in diagnosing and monitoring cardiac health."
90,"The image consists of two parts: an X-ray of the chest and an electrocardiogram (ECG) strip.

1. **Chest X-ray**: The upper portion shows a radiographic image of the thorax, revealing both lungs and the mediastinum. This image can provide critical information regarding lung conditions, such as infections, fluid accumulation, or structural anomalies.

2. **Electrocardiogram (ECG)**: The lower portion displays an ECG strip that tracks the electrical activity of the heart over time. This can help assess heart rhythm, identify any irregularities, and diagnose potential cardiac conditions.

Together, these images are commonly used in clinical settings to evaluate respiratory and cardiac health."
91,"The biomedical image presents data from a spirometry and flow-volume test. It includes the following key components:

1. **Graphs**: Two plots depicting flow-volume curves, with one graph likely representing the pre-medication state and the other post-medication after the administration of a bronchodilator (Ventolin).

2. **Time and Medication**: Recorded times (11:21 pre-medication and 12:17 post-medication) with the administered medication noted.

3. **Parameters**: 
   - Various pulmonary function parameters are listed, including:
     - FVCex (Forced Vital Capacity)
     - FEV1 (Forced Expiratory Volume in 1 second)
     - FEV1/FVC ratio
     - MEF (Maximal Expiratory Flow) at different percentages
     - PEF (Peak Expiratory Flow)
     - PIF (Peak Inspiratory Flow)
     - MVV (Maximum Voluntary Ventilation)

4. **Units and Predictions**: Each parameter includes units, pre-treatment predictions, post-treatment actual values, percentage of predicted values, and post-therapy percentage.

5. **Color Coding**: The results are color-coded to differentiate between pre- and post-medication values, indicating changes in pulmonary function after the inhalation of the medication.

This data is useful for evaluating respiratory function and the effectiveness of bronchodilator therapy in patients."
92,"The image displays an electrocardiogram (ECG) recording featuring multiple lead placements. It shows several distinct waveforms associated with heart activity, including P waves, QRS complexes, and T waves across different leads (I, II, III, aVR, aVL, aVF, and V1-V6).

Key features are:
- The vertical spikes in the QRS complexes indicate depolarization of the ventricles.
- The P waves represent atrial depolarization.
- The T waves show ventricular repolarization.
- Lead placements are labeled on the image, providing information on the heart's electrical activity from various angles.

This ECG can be used to assess heart rhythm, identify abnormalities, and interpret the overall cardiac function."
93,"The biomedical image depicts a microscopic view of cells displaying varying sizes and shapes. The cells are stained, with notable purple nuclei, indicating a likely hematological or cytological sample. The background is lighter, providing contrast to the distinct, darker regions of the nuclei within the cells. This type of staining is commonly used in histology to visualize cellular structures and can be indicative of a range of biological processes or pathologies. The presence of multiple cells in close proximity suggests an area of interest for further analysis, potentially related to cell proliferation or tissue morphology."
94,"The image appears to be an echocardiogram, which is a type of ultrasound used to visualize the heart's structure and function. 

### Description:
- **Orientation**: The image is in a typical triangular echocardiographic format, likely from a transthoracic echocardiogram (TTE).
- **Structures**: The echogenic areas represent heart tissues, likely displaying the left ventricle, potentially the left atrium, and possibly other cardiac structures.
- **Annotations**: There are labels such as 'P' (possibly indicating the position of the probe) and measurements (e.g., ""1.6"" and ""3.2"") which could represent dimensions of chambers or distances relevant to cardiac assessment.
- **Waveform**: At the bottom, there is a green line graph that may correspond to cardiac activity, reflecting the heart’s electrical signals, often seen in conjunction with echocardiographic images.

This type of imaging is critical for assessing heart function, detecting structural abnormalities, and guiding clinical decisions in cardiology."
95,"The image depicts the palm of a hand showing several skin lesions. These lesions appear as red or inflamed spots, some with a slightly raised texture. The surrounding skin looks generally healthy but has a few faint lines and markings. This presentation could be indicative of a dermatological condition, possibly related to an infection, allergic reaction, or another skin disorder. Further clinical context would be necessary for a precise diagnosis."
96,"The image is a cross-sectional view from a computed tomography (CT) scan of the abdominal region. Key components visible in this slice may include:

- Various abdominal organs such as the kidneys, liver, pancreas, and possibly the intestines.
- The aorta and inferior vena cava, important blood vessels in the abdominal cavity.
- Potential anatomical variations or abnormalities, which could include tumors, cysts, or signs of inflammation, depending on the clinical context.

The overall density and contrast in the image provide clues for assessing organ health and identifying any pathological conditions. Further analysis by a radiologist would be essential for a comprehensive interpretation."
97,"The image appears to be a radiographic (X-ray) view of the gastrointestinal tract, likely showing the stomach and part of the small intestine. The bright areas indicate the presence of contrast material, which is commonly used in imaging studies to enhance visibility of internal structures. These areas suggest the outline of the stomach, as well as a segment of the small intestine, allowing for assessment of the gastrointestinal anatomy and potential abnormalities."
98,"The biomedical image appears to be a coronal cross-sectional view from a CT scan of the chest, focusing on the lungs. The lungs show irregular opacities and nodular formations, which may suggest the presence of a pathological condition, possibly related to infection, inflammation, or neoplastic processes. The surrounding structures, including the spine, are also visible, providing context to the anatomical positioning of the lungs. The image is labeled with a date, indicating it was taken in 2020."
99,"The image appears to be a cross-sectional view from a CT scan of the abdominal region. Key features include:

- The presence of the liver, which shows a heterogeneous texture.
- There is an abnormality suggested by the dark areas, potentially indicating a lesion or cyst.
- Organs such as the stomach and parts of the intestines may also be visible in this section.
- The overall gray scale indicates differing densities of tissues, which is typical in CT imaging.

Further evaluation by a medical professional is necessary to interpret specific findings and determine their clinical significance."
100,"The image appears to be a coronal computed tomography (CT) scan of the abdomen and pelvis. The key features include:

- The presence of the lumbar vertebrae, indicating it is a scan taken at the lower trunk level.
- Visual representation of the pelvic organs, including the bladder, which is centrally located.
- Surrounding structures, such as parts of the intestine, kidneys, and possibly other organs, are also visible.
- The image shows a clear delineation of soft tissues, making it useful for assessing abdominal or pelvic conditions.

This type of scan is typically used to identify abnormalities or diseases in the abdominal and pelvic regions."
101,"The biomedical image presents a table showing the relationship between gastrointestinal symptoms and COVID-19 test results. It summarizes data from two groups: individuals who tested positive for COVID-19 (N = 278) and those who tested negative (N = 238). 

Key details include:

- **Any gastrointestinal symptoms**: 
  - Present: 160 individuals (97 positive, 63 negative) 
  - Absent: 356 individuals (181 positive, 175 negative)
  - Significance (P value): .04

- **Diarrhea**: 
  - Present: 92 individuals (56 positive, 36 negative) 
  - Absent: 424 individuals (222 positive, 202 negative)
  - Significance (P value): .14

- **Nausea/vomiting**: 
  - Present: 109 individuals (63 positive, 46 negative) 
  - Absent: 407 individuals (215 positive, 192 negative)
  - Significance (P value): .36

The P values indicate the level of statistical significance between the presence of symptoms and test results, with only ""any gastrointestinal symptoms"" showing a significant association."
102,"The image presents a forest plot summarizing various studies related to odds ratios and their confidence intervals (CIs). Each row lists a separate study, along with the study's odds ratio, weight in the meta-analysis, and the pooled estimate.

Key features include:

- **Study Names and Years**: Listed on the left, documenting each research study referenced in the analysis.
- **Odds Ratios**: Shown along the X-axis, indicating the strength of association between exposure and outcome across studies.
- **Weight (%)**: Reflects the contribution of each study to the overall pooled estimate.
- **Pooled Estimate**: Represented at the bottom with a combined odds ratio and CI, providing a comprehensive view of the data across all studies.
- **Heterogeneity Statistics**: Indicate the variability among study results (τ², P-value, I²).

The plot visually illustrates how individual study results compare to the overall pooled estimate and emphasizes studies with varying degrees of association within the provided confidence intervals."
103,"The image contains a table with numerical data related to biomedical statistics from Israel. The columns are labeled in Hebrew, indicating different categories or variables. The categories in the first column appear to refer to various types of medical assessments or tests, while the subsequent columns contain numerical values associated with these categories.

Here’s a brief breakdown of the table contents:

- The first row likely indicates the total number of assessments or results under a specific category.
- The first category mentions ""Bailout Skin Analysis,"" with numbers indicating the volumes for several different types, the second category specifies ""Biological Sample Analysis,"" and the third category may refer to a different testing type or methodology.
  
The numbers in each row represent counts or results associated with these categories in three different metrics or tests. The exact nature of these biomedical tests or the health context is not specified in the image provided."
104,"The image contains a table with data presented in Hebrew. The table appears to list values related to various biomedical parameters or measurements. Here’s a breakdown of the table:

- The first column is likely indicating specific tests or conditions related to ""סקר"" (screening).
- The second column shows a measurement or count related to each test, possibly the number of subjects or cases.
- The third column presents higher values, which could represent totals or a different category of measurement.

The categories listed include:
1. A specific type of screening related to ""הזויובת"" (possibly ""neuropathy"" or a similar term).
2. Another screening related to ""שלילית"" (likely ""negative"" or ""non-positive"").
3. A final category labeled ""ש"" (possibly ""Others"" or ""Total"").

The numbers indicate counts or results for each category, but without context, it's unclear what they specifically represent."
105,"The biomedical image presents a flowchart depicting the assessment process and outcomes of a study conducted from 1967 to 2010 in Israel. 

1. **Initial Assessments**: A total of 2,454,693 individuals were assessed.
2. **Exclusions**: 
   - 156,563 were excluded due to missing BMI data (64,186 individuals).
   - 92,377 were non-Jewish minorities deemed unrepresentative of the minority population.
3. **Analysis Group**: 2,298,130 individuals were included in the subsequent analysis.
4. **Mortality Data**: 
   - A total of 36,118 individuals died between 1967 and 2011.
   - Detailed mortality from 1967 to 1980: 
     - 3,991 deaths, with 803 cases having an unknown cause of death.
   - Detailed mortality from 1981 to 2011: 
     - 32,127 deaths, including:
       - 1,497 deaths due to coronary heart disease.
       - 528 deaths due to stroke.
       - 893 deaths classified as sudden death.
       - 1,662 cases with an unknown cause of death. 

The flowchart effectively summarizes the study's methodology and findings related to mortality causes over the specified period."
106,"The biomedical image presents a flowchart detailing the assessment and analysis of a study conducted in Israel from 1967 to 2010. 

Key points include:

1. **Total Individuals Assessed**: 2,454,693 individuals were initially assessed.
2. **Exclusion Criteria**: 
   - 156,563 individuals were excluded, with 64,186 missing BMI data and 92,377 being non-Jewish minorities deemed unrepresentative of the minority population.
3. **Final Sample Size**: 2,298,130 individuals remained for the analysis.
4. **Mortality Data**: 
   - 36,118 individuals died between 1967 and 2011.
   - 3,991 of those died between 1967 and 1980, with 803 missing cause of death.
   - 32,127 deaths occurred between 1981 and 2011, with specific causes of death categorized:
     - 1,497 from coronary heart disease
     - 528 from stroke
     - 893 from sudden death
     - 1,662 had missing cause of death.

The flowchart effectively summarizes the methodology and key findings related to mortality in the assessed population."
