id,caption
135,"The image appears to show a black and white microscopic view of cellular structures or microbial colonies. You can see circular shapes, possibly representing bacterial colonies or cellular aggregates, with some features extending outwards, which could be bacterial flagella or filaments. The background seems to have a gradient, perhaps indicating different areas of focus or varying substrate. This type of imagery is commonly used in microbiology or cell biology to visualize the morphology and growth patterns of microorganisms."
136,"The image appears to depict a microscopic view of a tissue section, likely stained to highlight cellular components. 

Key features include:

- **Red-stained cells**: These may represent blood cells or other cellular structures within the tissue.
- **Fibrous structures**: The underlying architecture suggests the presence of connective tissue, which may be indicative of a specific tissue type, such as muscle or skin.

The specific staining technique used might be aimed at highlighting particular cell types or pathological features within the tissue."
137,"The image displays a microscopic view of blood cells, specifically highlighting a white blood cell. The central cell appears larger than the surrounding red blood cells, exhibiting a distinctive morphology. It contains a prominent nucleus that is stained in a dark purple hue, indicating high activity or a specific type of immune response. The presence of granular structures within the cell suggests it may be a type of granulocyte or another immune cell involved in the body's defense mechanisms. The surrounding red blood cells are pale, indicating normal erythrocyte morphology."
138,"The image appears to show a microscopic view of a biological sample, likely focusing on cellular structures. It displays a larger cell body with a distinct morphology, and surrounding it are smaller, circular entities, which may represent other cells, vesicles, or cellular debris. The central area seems to have more defined structures, possibly indicating a nucleus or a concentration of proteins. The monochrome appearance suggests it may be a phase-contrast or other light-microscopy technique used to enhance visibility of the sample's features."
139,"The image appears to show a microscopic view of biological samples, with various cellular structures prominently displayed. The predominant features include:

- **Red Blood Cells (Erythrocytes)**: There are multiple circular, pink-stained entities, which likely represent red blood cells. They typically appear as biconcave discs.
- **Bacterial Cells or Fungal Elements**: Smaller, more spherical structures with a dotted appearance might indicate bacterial or fungal elements, which are common in microbiological samples.
- **Fibrous Structures**: There are also elongated, thin structures that could represent filaments from bacteria or fungal hyphae.

The background is light, enhancing the contrast of the stained cells and structures. This type of image is often used in microbiology or hematology to examine blood samples or detect microbial infections."
140,"The image appears to be a computed tomography (CT) scan of a human brain in a cross-sectional view. Key features noticeable in this image include:

- **Appearance of a Cyst or Tumor**: Centralized within the brain, there seems to be an abnormal dark area which could indicate a cyst, tumor, or another type of lesion. This area contrasts with the surrounding brain tissue.
- **Cerebral Edema**: The surrounding brain tissue may show signs of edema (swelling), which can be inferred from changes in density.
- **Cortical Structure**: The outline of the brain's cortex is visible, demarcating the normal anatomy versus the affected area.

This scan would likely require further evaluation by a medical professional to determine the specific nature of the pathology observed."
141,"The image is a CT scan of the brain, viewed axially. It shows the structure of the brain with distinct grey and white matter. The cerebral cortex is visible around the edges, and the ventricles are represented in the center, appearing darker due to the presence of cerebrospinal fluid. The scan is displayed in grayscale, allowing for the identification of any abnormal areas, such as lesions or hemorrhages, if present. The symmetry of the brain structures can also be assessed from this perspective."
142,"The image appears to be a cross-sectional view from a computed tomography (CT) scan of the brain. Key features observed include:

- The overall structure of the cerebral hemispheres, which are visible on both sides of the image.
- The midline structures, such as the corpus callosum, are identifiable in the center, dividing the two hemispheres.
- The sulci (grooves) and gyri (folds) of the cerebral cortex can be seen, indicating the folds of the brain.
- The basal ganglia structures may also be noted near the deeper regions of the brain.

This CT scan can be used for analyzing various brain conditions, including trauma, tumors, or cerebrovascular accidents. Further clinical context would be needed to provide a more specific interpretation."
143,"The biomedical image presents two circular plots labeled A (OS) and B (OD). 

- **Plot A (OS)**: This shows a dense cluster of points concentrated towards the center, indicating normal or expected data distribution for the left eye (oculus sinister).
- **Plot B (OD)**: This plot displays a different pattern, with points clustered towards the upper right quadrant, suggesting an abnormal distribution or condition affecting the right eye (oculus dexter).

The differences between the two plots may illustrate a comparative analysis of visual function or data from tests such as visual field assessments."
144,"The image consists of two MRI scans of the brain: an axial view on the left and a coronal view on the right.

1. **Axial View (Left)**: This cross-section displays the brain in a horizontal plane, showing the cerebral hemispheres and the central cavity (ventricles) which appear bright. The surrounding gray matter shows typical textural patterns indicating brain structure.

2. **Coronal View (Right)**: This vertical slice provides a frontal perspective of the brain, revealing the lateral ventricles prominently in the middle along with surrounding brain structures such as the cortex. 

The use of MRI imaging allows for detailed visualization of brain anatomy and potential pathological changes."
145,"The image contains three distinct waveforms represented in a red color against a white background. 

1. **Top waveform**: Appears jagged and irregular, suggesting it may represent a complex signal, possibly related to biological data, such as neural activity or muscle contractions.
   
2. **Middle waveform**: This waveform is also irregular but appears to have a more structured pattern compared to the top one. It could indicate periodic biological activity, such as heartbeats or other rhythmic physiological signals.

3. **Bottom waveform**: This is a smooth, sinusoidal waveform, which typically represents a consistent and regular frequency. It might correspond to a stable signal, such as a baseline physiological function or a normal sound frequency.

Overall, these waveforms may represent different types of physiological data or signals relevant to biomedical analysis."
146,"The image consists of three rows of waveforms depicted in red. Each row represents different wave patterns:

1. The top waveform shows a highly irregular and jagged structure, indicative of complex signals or biological data, possibly reflecting varying amplitudes over time.
2. The middle waveform appears more structured but still has some irregularity, suggesting a rhythmic or periodic signal.
3. The bottom waveform displays a smooth, sinusoidal pattern, often associated with a regular, consistent frequency, which could represent a stable physiological signal like a heartbeat.

These visual representations could be utilized in various biomedical contexts, such as analyzing electrical signals from the heart or other biological systems."
147,"The image is an axial magnetic resonance imaging (MRI) scan of the brain. Key features include:

- The brain structures are visible, including the cerebral hemispheres, the ventricles (fluid-filled spaces), and the brainstem.
- The scan exhibits the normal anatomical features of the brain, with clear delineation between gray and white matter.
- The ventricles appear to be of normal size, indicating an absence of significant swelling or mass effect.
- Potential artifacts or variations might be visible (indicated by the inset), which could be related to the imaging technique or patient positioning.

This MRI can be used for diagnosing a variety of neurological conditions or assessing brain anatomy."
148,"The image appears to be a CT scan of the brain, shown in axial (horizontal) view. Key features of the scan include:

- Areas of varying density indicating potential abnormalities, which may suggest the presence of a lesion or other pathologies.
- The central area of the image appears darker, which could indicate fluid or lack of tissue density.
- The surrounding brain tissue may show signs of edema or other changes.

Further analysis by a medical professional is necessary to interpret the results accurately and determine any clinical significance."
149,"The image depicts a diagram highlighting Heschl’s gyrus, which is a part of the auditory cortex located in the temporal lobe of the brain. The illustration shows the distinctive folded structure of the gyrus, with an arrow pointing to it to emphasize its location. Heschl's gyrus is crucial for processing auditory information, particularly in the perception of sound."
150,"The image depicts a brain MRI in an axial view. There is a region highlighted by an arrow that indicates an area of abnormality, appearing as a hyperintense (bright) lesion on the scan. This could suggest various conditions, such as edema, inflammation, or a lesion, depending on the clinical context. The surrounding brain tissue appears normal, but further evaluation would be required to determine the nature of the highlighted area."
151,"This image appears to be an MRI scan of the brain viewed axially. Key features may include:

- **Cerebral structure:** The image shows the typical brain anatomy, including the cerebellum, cerebral hemispheres, and possibly parts of the brainstem.
- **Tissue contrast:** Various brain tissues are displayed with different intensities, indicating areas of gray matter and white matter.
- **Fluid spaces:** The ventricles may be visible, which are fluid-filled cavities in the brain.

Overall, this MRI scan provides information about brain morphology and can help diagnose various neurological conditions."
152,"The image is an axial view from an MRI scan of the brain, specifically showing the area around the brainstem and cranial nerves. The image presents distinct contrast between different brain tissues, with the highlighted region pointing to a notable structure or abnormality within the brainstem. This type of scan is often used to assess various conditions, including tumors, lesions, or other neurological disorders affecting the brain. The surrounding anatomy includes the cerebellum, which can be seen in the upper portion of the image."
153,"The image shows a magnetic resonance imaging (MRI) scan of the lumbar spine, viewed in a sagittal plane. Key features visible in the scan include:

- A series of vertebral bodies stacked vertically, indicating the lumbar region of the spine.
- Intervertebral discs located between the vertebrae, which can be assessed for signs of degeneration or herniation.
- The spinal canal is visible, containing the spinal cord and surrounding cerebrospinal fluid.
- The overall alignment and integrity of the vertebrae and discs can be evaluated for any abnormalities such as lesions or compression.

This type of imaging is commonly used for diagnosing back pain, disc herniation, and other spinal conditions."
154,"The image appears to be a CT scan of the brain. It shows the cross-sectional view of the cranial cavity, highlighting the brain structure. There is a distinct area indicated by an arrow, which may suggest some form of abnormality or pathology, possibly indicating a lesion, hemorrhage, or other brain injury. The overall density and appearances of the brain tissue can provide insights into various conditions affecting the brain."
155,"The image shows a simplified illustration of a human face focusing on the lower part, particularly the area around the chin and mouth. An arrow points to a shaded section of the chin, indicating an anatomical feature or area of interest. The text above appears to be in a different language, possibly Hebrew, but its content is not decipherable from the image alone. This type of illustration is often used in biomedical contexts to highlight specific anatomical regions for educational purposes."
156,"The image appears to show a retinal photograph, specifically of the fundus of the eye. In this image, the highlighted area, indicated by the arrow, seems to represent a significant retinal feature, possibly suggesting a pathological condition. The background is characterized by reddish-orange hues, typical of retinal images, with visible blood vessels throughout.

The area pointed out by the arrow appears to be a lesion or abnormality, potentially indicative of conditions such as a retinal detachment, drusen, or other retinal diseases. Further clinical correlation would be necessary to determine its exact nature and implications for ocular health."
157,"The biomedical image consists of two sections:

1. **Left Section**: This appears to show a histological cross-section of a tissue sample, likely from an organ. The stain used highlights various structures, revealing layers of cells with a noticeable cavity or lumen present.

2. **Right Section**: This image shows a higher magnification view of cellular structures, displaying densely packed cells that exhibit varying shapes and sizes. The purple staining indicates the presence of nuclei, suggesting a highly cellular environment, which may indicate processes such as inflammation or tumor formation.

Overall, the images depict histological features that may be relevant for diagnosis or research in a biomedical context."
158,"The image appears to be a close-up view of biological tissue, possibly from a medical examination such as an endoscopy. It shows irregular formations with varying textures and colors, suggesting inflammation or infection. Red streaks could indicate blood vessels or vascular structures, while the presence of small, white, or yellowish spots may suggest lesions or deposits. The overall scene seems to depict abnormal tissue, which could be indicative of a pathological condition. Further context or clinical data would be necessary for a more accurate interpretation."
159,"The biomedical image shows a three-dimensional structure that appears to be a crystal or a similarly transparent material, illuminated in shades of pink and purple. The structure has intricate details and a complex shape, suggesting it may be related to biological tissues or a synthetic biomaterial. The background is a solid light color, enhancing the visibility of the translucent object. This type of imagery is often used in biomedical research to analyze the morphology or properties of biological specimens."
160,"The biomedical image depicts a cross-section of a tissue sample, likely from skin or another organ. The image shows a layer of epithelial cells at the top, characterized by a darker, densely packed area, and beneath it, there is a lighter area containing what appears to be a vascular structure or an area of inflammation, indicated by the reddish tint. This suggests a possible focal point of blood vessels or an area of cellular activity, which could be related to various physiological or pathological processes. The overall cellular architecture shows a differentiation between the epidermis at the top and the underlying tissues."
161,"The image appears to show a histological section of a tissue sample, likely analyzed under a microscope. The staining indicates the presence of various cellular components. Key features include:

- **Tissue Architecture:** The image displays a cross-section of a tissue with folds or villi, suggesting it may be from an organ like the intestine or a similar epithelial structure.
- **Cell Types:** There are areas of denser staining, which may indicate regions of glandular tissue or cellular proliferation.
- **Background:** The lighter pink areas might represent connective tissue or stroma surrounding the epithelium.

Overall, this sample likely represents normal or pathological findings in epithelial tissue, requiring further context for specific diagnosis."
162,"The image shows the eyes of a child wearing blue eyeglasses, depicted in two separate frames. 

- The top frame displays one eye appearing to be misaligned, possibly indicating strabismus or another eye condition, while the other eye is aligned properly.
- The bottom frame showcases the child's eyes with a different alignment, suggesting a potential change in focus or positioning.

This comparison may be part of an assessment of vision or eye alignment issues in the child."
163,"The image shows the eyes of a child. The child has brown eyes, and there is noticeable strabismus, characterized by misalignment where the left eye appears to be turned inward compared to the right eye. This condition can affect depth perception and may require further evaluation by a healthcare professional. The skin around the eyes shows mild discoloration, which could be indicative of various conditions or simply a variation in skin tone."
164,"The image appears to show two sets of photographs featuring a child's eyes, likely for a comparative analysis. The top image displays eyes with a normal appearance, while the bottom image may show a different condition or state, possibly emphasizing differences in pupil size, symmetry, or surrounding tissue.

The text is in Hebrew, indicating a focus on visual assessment, potentially related to diagnosing or distinguishing between far-sightedness and near-sightedness or other ocular conditions."
165,"The biomedical image displays two similar microscopic views of cells or structures, likely from a biological sample. Each image shows a central body surrounded by radial extensions or filaments that appear to be branching outwards.

- **Left Image:** The central body has a distinct structure, with more pronounced extensions showing a variety of branching forms.
- **Right Image:** The central region appears similar but exhibits a slight variation in the arrangement of the filaments, possibly indicating different conditions or stages of biological processes.

These images could represent cellular structures, such as neurons or other types of cells, and their morphology may provide insights into physiological or pathological states."
166,"The biomedical image showcases a detailed view of an eye, specifically highlighting the cornea and its surrounding structures. The image appears to illustrate a slit-lamp examination, indicated by the vertical beam of light shining onto the cornea. 

Key observations include:

- **Corneal Surface**: The cornea exhibits a clear structure, with visible layers.
- **Red Reflex**: A reddish hue may suggest the presence of superficial blood vessels or could be a reflection of the illumination.
- **Focus Area**: The bright line of light is used for assessing the corneal integrity, possibly looking for abnormalities such as edema, lesions, or foreign bodies.

This type of examination is crucial in the diagnosis and management of various ocular conditions."
167,"The image depicts a child with multiple skin lesions on the face, particularly on the forehead and cheek area. These lesions appear as small, dome-shaped nodules, some of which are pink and others are darker in color. The child's expression is neutral, and they have curly hair. The clinical significance of these lesions would require further evaluation by a healthcare professional for accurate diagnosis and potential treatment."
168,"The image appears to be an axial computed tomography (CT) scan of the head, specifically focusing on the nasal and paranasal sinus regions. Key features include:

- **Sinuses**: The image shows bilateral maxillary sinuses, which may or may not exhibit fluid levels, possibly indicating sinusitis.
- **Nasal Cavity**: The central structure is the nasal cavity, which appears to be relatively symmetric.
- **Airway**: The nasal passages and part of the oral cavity are visible, indicating the airway structures.
- **Bone Structures**: The bony outlines of the skull base and facial bones are visible, providing context to the soft tissue structures.

Overall, the CT scan helps assess conditions related to sinus health, nasal obstructions, or other pathologies in the head and neck region."
169,"The biomedical image consists of two parts:

1. **Left Image**: A close-up view of the face of a young individual, focusing on the eyes. The eyes appear normal with a clear view of the irises and pupils.

2. **Right Image**: A coronal cross-sectional CT scan of the sinuses and surrounding structures. The image likely shows the anatomical details of the nasal cavities, sinuses, and potential abnormalities. Key features such as the orbits (eye sockets) and nasal passages are visible, which could be relevant for diagnosing conditions related to the sinuses or eyes.

Overall, the image set may be utilized for an examination of ocular health or sinus-related issues."
170,"The image displays two close-up views of human eyes, both exhibiting similar characteristics. 

- **Left Image:** The eyes appear red and inflamed, with noticeable irritation and swelling around the eyelids and conjunctiva. The skin around the eyes shows signs of aging, such as wrinkles and sagging.

- **Right Image:** The eyes, while still showing some redness, appear less inflamed compared to the left image. The surrounding skin also displays aging features, but the overall appearance seems healthier.

These images could potentially indicate differences in ocular health or may represent the effects of treatment or a condition affecting the eyes."
171,"The biomedical image depicts a close-up view of an eye during a surgical procedure. The eye appears to be undergoing an intervention, possibly related to the eyelid or surrounding tissues. Tweezers are being used to manipulate a structure, and the area around the eye is swollen and red, indicating surgical intervention or irritation. There is visible fluid, likely indicating the context of surgery. The surrounding area includes eyelashes and some gauze. Overall, the image shows a detailed moment in an ophthalmic or oculoplastic surgical procedure."
172,"The image depicts a close-up of a human eye, specifically focusing on the area near the eyelid. An arrow is pointing to a small lesion or abnormality located on the skin alongside the eye. The surrounding skin appears normal, and the eye itself is a healthy color. This type of image could be used for clinical examination or educational purposes, possibly indicating a dermatological concern or an eye-related condition."
173,"The biomedical image consists of three sections:

1. **Left Image**: A close-up view of a person's eyes, displaying their open eyes and natural appearance. This could indicate a focus on ocular health or assessment.

2. **Middle Image**: An axial CT scan of the orbits (eye sockets). This image provides a cross-sectional view, likely used for evaluating conditions related to the eyes or surrounding structures.

3. **Right Image**: A histological section showing tissue stained with hematoxylin and eosin (H&E). This image displays cellular structures, possibly from an eye-related pathology. The arrangement of cells and tissues can assist in diagnosing various conditions.

Together, these images encompass clinical observation, imaging, and histological analysis related to ocular health."
174,"The image depicts a close-up view of an eye, specifically focusing on the conjunctival area. There is visible redness and some swelling around the eyelid and conjunctiva, which may indicate inflammation or irritation. The arrow points to a specific area where there may be signs of injury, infection, or surgical intervention. The iris and pupil are also visible, indicating the eye is functional. This kind of imagery is typically used for educational purposes in ophthalmology or related medical fields."
175,"The image depicts a T2-weighted axial MRI scan of the brain. Key features include:

- The characteristic ""butterfly"" shape of the lateral ventricles at the center, with surrounding brain tissue visible.
- The cortex is clearly outlined, showing gyri and sulci.
- The brightness of the cerebrospinal fluid (CSF) in the ventricles highlights its presence.
- No apparent abnormalities such as lesions or mass effects are noted in this static presentation.

This type of image is often used for assessing brain anatomy and identifying pathological conditions."
